title,publication_date,source,url,description,ai_keywords_found,ce_keywords_found
ATS Announces Normal Course Issuer Bid,2025-12-18T12:09:18Z,Financial Post,https://financialpost.com/pmn/business-wire-news-releases-pmn/ats-announces-normal-course-issuer-bid-3,"CAMBRIDGE, Ontario — ATS Corporation (TSX and NYSE: ATS) (“ATS” or the “Company”), today announced that the Toronto Stock Exchange (“TSX”) has accepted a notice filed by it of its intention to make a normal course issuer bid (“NCIB”). As of December 10, 2025,…",automation,"transportation, bridge"
"ALSTOM S.A: Alstom awarded 1.0 billion euro share of Suburban Rail Loop East Line Contract in Melbourne, Australia",2025-12-18T07:30:00Z,GlobeNewswire,https://www.globenewswire.com/news-release/2025/12/18/3207451/0/en/ALSTOM-S-A-Alstom-awarded-1-0-billion-euro-share-of-Suburban-Rail-Loop-East-Line-Contract-in-Melbourne-Australia.html,"18 December 2025 – Alstom, global leader in smart sustainable mobility, as part of the TransitLinX Alliance, has been awarded a 1.0 billion euro share (1.8 billion Australian dollars) of a 4.9 billion euro contract (8.8 billion Australian dollars) by the Subu…",automation,"transportation, infrastructure"
"IoT Identity and Access Management Market Report 2030: USD 14 Billion Opportunity at 20.97% CAGR, Says Mordor Intelligence",2025-12-17T15:07:00Z,GlobeNewswire,https://www.globenewswire.com/news-release/2025/12/17/3207105/0/en/IoT-Identity-and-Access-Management-Market-Report-2030-USD-14-Billion-Opportunity-at-20-97-CAGR-Says-Mordor-Intelligence.html,"Demand for the IoT identity access management market is accelerating, driven by zero-trust adoption, secure device authentication needs, and rapid expansion of connected ecosystems. Demand for the IoT identity access management market is accelerating, driven …",automation,"transportation, infrastructure"
Ingersoll Rand Welcomes Jerome Guillen to Board of Directors,2025-12-17T13:30:00Z,GlobeNewswire,https://www.globenewswire.com/news-release/2025/12/17/3206972/0/en/Ingersoll-Rand-Welcomes-Jerome-Guillen-to-Board-of-Directors.html,"DAVIDSON, N.C., Dec. 17, 2025 (GLOBE NEWSWIRE) -- Ingersoll Rand Inc. (NYSE: IR), a global provider of mission-critical flow creation and life sciences and industrial solutions, today announced the appointment of Jerome Guillen to its Board of Directors, effe…",automation,transportation
"SNS INSIDER PVT. LTD.デジタル変電所市場は、2032年までに年平均成長率7.2%で成長し、137億1,000万米ドルに達すると予測されている。",2025-12-17T00:00:00Z,CNET,https://japan.cnet.com/release/31135598/,"Digital Substation Market Overview: The digital substation market is expanding rapidly due to increasing investments in power grid modernization, growing energy efficiency, and the global drive toward renewable energy integration. Digital substations utilize …",automation,"transportation, infrastructure"
How freight brokers can succeed in 2026: A strategic guide to resilience,2025-12-16T19:00:00Z,Yahoo Entertainment,https://finance.yahoo.com/news/freight-brokers-succeed-2026-strategic-190000221.html,"After years of volatility, players across the transportation industry are holding hope that 2026 brings equilibrium. Many analysts forecast 2026 to be a...",automation,transportation
Pharma Supply Chain & Security World Returns to London: Building a Connected and Resilient Ecosystem,2025-12-16T15:38:00Z,GlobeNewswire,https://www.globenewswire.com/news-release/2025/12/16/3206411/28124/en/Pharma-Supply-Chain-amp-Security-World-Returns-to-London-Building-a-Connected-and-Resilient-Ecosystem.html,"Key market opportunities include leveraging advanced technologies like IoT, AI, ML, and Blockchain for supply chain optimization and traceability, ensuring regulatory compliance, and enhancing product security and safety through serialization and anti-counter…",automation,transportation
Driverless Car Sensors Market Size to Grow USD 25.04 Billion by 2033 | Research by SNS Insider,2025-12-16T13:00:00Z,GlobeNewswire,https://www.globenewswire.com/news-release/2025/12/16/3206145/0/en/Driverless-Car-Sensors-Market-Size-to-Grow-USD-25-04-Billion-by-2033-Research-by-SNS-Insider.html,"Driverless Car Sensors Market Size, Share & Trends Analysis Report, By Sensor Type, Application, Vehicle Type, End-User, and Region | Forecast 2026-2033...",automation,"transportation, infrastructure"
Smart Cards Market Surge: Insights on Growth Trends and Future Projections,2025-12-16T12:47:00Z,GlobeNewswire,https://www.globenewswire.com/news-release/2025/12/16/3206128/28124/en/Smart-Cards-Market-Surge-Insights-on-Growth-Trends-and-Future-Projections.html,"The smart cards market presents key opportunities in secure digital ID, payment systems, and authentication across sectors such as banking, healthcare, and transportation. Growth is driven by modernization and regulatory needs, with tech advances and dual int…",automation,"transportation, bridge, infrastructure"
ATS Announces Doug Wright as Chief Executive Officer,2025-12-16T12:04:11Z,Financial Post,https://financialpost.com/pmn/business-wire-news-releases-pmn/ats-announces-doug-wright-as-chief-executive-officer,"CAMBRIDGE, Ontario — ATS Corporation (TSX: ATS) (NYSE: ATS) (“ATS” or the “Company”) today announced that Doug Wright has been appointed Chief Executive Officer (CEO) and a member of its Board of Directors, commencing on or before January 14, 2026. Mr. Wright…",automation,"transportation, bridge"
Fobi AI Launches “FIXYR” the Company’s Agentic AI Customer Service & Technical Support Platform,2025-12-15T22:54:29Z,Financial Post,https://financialpost.com/globe-newswire/fobi-ai-launches-fixyr-the-companys-agentic-ai-customer-service-technical-support-platform,"FIXYR Initial Activation Processed Over 20,000 Digital Tickets and 200+ Customer Inquiries with 100% Uptime, 100% Satisfaction, and Zero Human Intervention Vancouver, BC, Dec. 15, 2025 (GLOBE NEWSWIRE) — Fobi AI Inc. (TSXV:FOBI, Pink:FOBIF) (“Fobi” or the “Co…",automation,"transportation, infrastructure"
Fobi AI Launches “FIXYR” the Company’s Agentic AI Customer Service & Technical Support Platform,2025-12-15T22:50:00Z,GlobeNewswire,https://www.globenewswire.com/news-release/2025/12/15/3205905/0/en/Fobi-AI-Launches-FIXYR-the-Company-s-Agentic-AI-Customer-Service-Technical-Support-Platform.html,"FIXYR Initial Activation Processed Over 20,000 Digital Tickets and 200+ Customer Inquiries with 100% Uptime, 100% Satisfaction, and Zero Human Intervention FIXYR Initial Activation Processed Over 20,000 Digital Tickets and 200+ Customer Inquiries with 100% Up…",automation,"transportation, infrastructure"
Rice Market Insights and Growth Forecast 2025-2032 - Increasing Investments in Rice Milling Automation and Digital Supply Chain Traceability Solutions,2025-12-15T16:06:00Z,GlobeNewswire,https://www.globenewswire.com/news-release/2025/12/15/3205631/28124/en/Rice-Market-Insights-and-Growth-Forecast-2025-2032-Increasing-Investments-in-Rice-Milling-Automation-and-Digital-Supply-Chain-Traceability-Solutions.html,"The global rice market presents opportunities in health-oriented and specialty products, sustainable practices, and advanced digital solutions for quality and traceability. Flexible supply chains and strategic collaborations bolster resilience amid evolving c…",automation,transportation
"Qued Named 2025 Top Tech Startup by Food Logistics, Supply & Demand Chain Executive",2025-12-15T14:39:00Z,GlobeNewswire,https://www.globenewswire.com/news-release/2025/12/15/3205546/0/en/Qued-Named-2025-Top-Tech-Startup-by-Food-Logistics-Supply-Demand-Chain-Executive.html,Prestigious tech award spotlights top software and technology startups revolutionizing the supply chain and logistics space Prestigious tech award spotlights top software and technology startups revolutionizing the supply chain and logistics space,automation,"transportation, construction, concrete"
"Faisal Al-Husseini on Bahri’s Next Wave: Digital Twins, Immersive Training, and Decarbonization",2025-12-15T08:00:00Z,Ship Technology,https://www.ship-technology.com/excellence-awards/excellence-in-focus/faisal-al-husseini-bahri-digital-twin-immersive-training/,"In this interview, Bahri Chemicals President Faisal Al-Husseini details how the company is advancing the maritime industry’s next wave—following Bahri’s win ...",automation,transportation
Award-Winning CTO Gaurav Sharda Advances AI-Driven Modernization in Special-Needs Student Transportation Nationwide,2025-12-12T19:58:49Z,International Business Times,https://www.ibtimes.com/award-winning-cto-gaurav-sharda-advances-ai-driven-modernization-special-needs-student-3792511,"His AI-powered initiatives are redefining safety, equity, and efficiency for more than 350,000 special-needs students across the United States.","artificial intelligence, automation","transportation, bridge, infrastructure"
"A Colorado guaranteed income program could help families, but the costs are high",2025-12-12T14:32:21Z,Yahoo Entertainment,https://www.yahoo.com/news/articles/colorado-guaranteed-income-program-could-143221624.html,A few hundred extra dollars a month would go a long way for many Coloradans.,"artificial intelligence, automation","transportation, bridge"
LOBO Announces Integration of Experienced Solar Team into Jiangsu LOBO; Represents a Strong Entry into the PV Energy Storage Power Generation Sector,2025-12-12T13:56:00Z,GlobeNewswire,https://www.globenewswire.com/news-release/2025/12/12/3204651/0/en/LOBO-Announces-Integration-of-Experienced-Solar-Team-into-Jiangsu-LOBO-Represents-a-Strong-Entry-into-the-PV-Energy-Storage-Power-Generation-Sector.html,"WUXI, China, Dec. 12, 2025 (GLOBE NEWSWIRE) -- LOBO TECHNOLOGIES LTD. (NASDAQ: LOBO) (“LOBO” or the “Company”), a developer and manufacturer of electric mobility and smart energy solutions, today announced that its operating subsidiary, Jiangsu LOBO Electric …",automation,transportation
"A Colorado guaranteed income program could help families, but the costs are high",2025-12-12T13:51:23Z,The Conversation Africa,https://theconversation.com/a-colorado-guaranteed-income-program-could-help-families-but-the-costs-are-high-269082,A few hundred extra dollars a month would go a long way for many Coloradans.,"artificial intelligence, automation","transportation, bridge"
Green Chemicals Market Set to Exceed USD 201Bn by 2030 Says a 2025 Mordor Intelligence Report,2025-12-12T13:15:00Z,GlobeNewswire,https://www.globenewswire.com/news-release/2025/12/12/3204620/0/en/Green-Chemicals-Market-Set-to-Exceed-USD-201Bn-by-2030-Says-a-2025-Mordor-Intelligence-Report.html,"Global green chemicals market is accelerating due to rapid net-zero policy shifts and cost-efficient synthetic-biology platforms, as bio-polymers product type is forecast to grow at 11.45% CAGR to 2030 Global green chemicals market is accelerating due to rapi…",automation,"transportation, construction"
Steel Casting Market Size to Worth USD 66.80 Billion by 2035 - Exclusive Report by Towards Chemical and Materials,2025-12-12T10:06:00Z,GlobeNewswire,https://www.globenewswire.com/news-release/2025/12/12/3204509/0/en/Steel-Casting-Market-Size-to-Worth-USD-66-80-Billion-by-2035-Exclusive-Report-by-Towards-Chemical-and-Materials.html,"According to Towards Chemical and Materials Consulting™, the global steel casting market was estimated to be USD 38.99 billion in 2025....",automation,"structural, construction, transportation, infrastructure"
Bus and Coach Market Set to Expand to $21.61 Billion by 2029 with 5.3% CAGR Growth,2025-12-12T09:07:00Z,GlobeNewswire,https://www.globenewswire.com/news-release/2025/12/12/3204487/28124/en/Bus-and-Coach-Market-Set-to-Expand-to-21-61-Billion-by-2029-with-5-3-CAGR-Growth.html,"Key opportunities in the buses and coaches market include growth driven by urbanization and demand in emerging markets. The shift to electric and sustainable mobility solutions, demand for mini-buses, and favorable government policies also contribute. Technol…",automation,transportation
SEALSQ Appoints Rolf Gobet as Director of Its Geneva Quantum Center of Excellence,2025-12-12T06:00:00Z,GlobeNewswire,https://www.globenewswire.com/news-release/2025/12/12/3204440/0/en/SEALSQ-Appoints-Rolf-Gobet-as-Director-of-Its-Geneva-Quantum-Center-of-Excellence.html,"Geneva, Switzerland, Dec. 12, 2025 (GLOBE NEWSWIRE) -- SEALSQ Corp (NASDAQ: LAES) (""SEALSQ"" or ""Company""), a company that focuses on developing and selling Semiconductors, PKI, and Post-Quantum technology hardware and software products, today announces the ap…",automation,"transportation, infrastructure"
BlueGrace Logistics Joins Triumph Network,2025-12-11T21:35:00Z,GlobeNewswire,https://www.globenewswire.com/news-release/2025/12/11/3204329/28528/en/BlueGrace-Logistics-Joins-Triumph-Network.html,"BlueGrace Logistics joins Triumph Network, adopting its payment platform to streamline carrier payments with faster, transparent and flexible options....",automation,transportation
"Mitsubishi HC Capital Canada Outlines Industrial Outlook for 2026: Stability, Strategy, and Smart Investment",2025-12-11T17:37:02Z,Financial Post,https://financialpost.com/globe-newswire/mitsubishi-hc-capital-canada-outlines-industrial-outlook-for-2026-stability-strategy-and-smart-investment,"From automation and labor shortages to tariff uncertainty and economic caution, Mitsubishi HC Capital Canada forecasts the evolving factors influencing business growth MONTREAL, Dec. 11, 2025 (GLOBE NEWSWIRE) — Mitsubishi HC Capital Canada, a leading non-bank…","robotics, automation","transportation, construction, infrastructure"
"Substation Automation Market Intelligence Report 2025-2032: Trends, Drivers, Challengers, Competition, Shares and Growth Prospects",2025-12-11T16:41:00Z,GlobeNewswire,https://www.globenewswire.com/news-release/2025/12/11/3204152/28124/en/Substation-Automation-Market-Intelligence-Report-2025-2032-Trends-Drivers-Challengers-Competition-Shares-and-Growth-Prospects.html,"Dublin, Dec. 11, 2025 (GLOBE NEWSWIRE) -- The ""Substation Automation Market - Global Forecast 2025-2032"" report has been added to ResearchAndMarkets.com's offering.","artificial intelligence, automation","transportation, infrastructure"
Trends in Edible Oil Packaging Market 2025-2035,2025-12-11T16:11:00Z,GlobeNewswire,https://www.globenewswire.com/news-release/2025/12/11/3204113/0/en/Trends-in-Edible-Oil-Packaging-Market-2025-2035.html,"The edible oil packaging market is set to expand from USD 5.78 billion in 2022 to USD 10.11 billion by 2032, driven by sustainability....","artificial intelligence, automation","transportation, infrastructure"
"Click&Share Launches AI-Powered Autonomous Bike Rental Platform, Cutting Operating Costs Up to 70%",2025-12-11T15:43:00Z,GlobeNewswire,https://www.globenewswire.com/news-release/2025/12/11/3204090/0/en/Click-Share-Launches-AI-Powered-Autonomous-Bike-Rental-Platform-Cutting-Operating-Costs-Up-to-70.html,Complete End-to-End Solution Enables True 24/7 Staff-Free Operations Across Any Location Complete End-to-End Solution Enables True 24/7 Staff-Free Operations Across Any Location,automation,transportation
OpenAI boss Sam Altman predicts next big AI breakthrough,2025-12-24T15:04:27Z,The-independent.com,https://www.the-independent.com/tech/openai-sam-altman-ai-breakthrough-chatgpt-b2890125.html,CEO of ChatGPT creator says AI firms may be focussing on the wrong thing,artificial intelligence,infrastructure
How investment giant Vanguard’s CIO is placing big tech bets today to create the AI digital advisor of tomorrow,2025-12-24T14:57:36Z,Fortune,https://fortune.com/2025/12/24/vanguards-cio-niti-tandon-ai-digital-advisor/,Vanguard CIO Nitin Tandon says AI can be used to hyper-personalize guidance for customers.,"generative AI, artificial intelligence",infrastructure
Good Climate News to End the Year,2025-12-24T14:54:33Z,Financial Post,https://financialpost.com/pmn/business-pmn/good-climate-news-to-end-the-year,"This year brought major setbacks on climate action, but there were wins, too.",artificial intelligence,"bridge, infrastructure"
"The Zacks Analyst Blog Highlights NVIDIA, Advanced Micro Devices, Intel, Micron Technology and BigBear.ai",2025-12-24T14:42:00Z,Yahoo Entertainment,https://finance.yahoo.com/news/zacks-analyst-blog-highlights-nvidia-144200337.html,Zacks' Analyst Blog says investors may look past NVIDIA as Micron and BigBear.ai outperform in 2025 and offer more upside from AI demand.,"generative AI, artificial intelligence",infrastructure
A $61 Billion Reason to Buy Amazon Stock for 2026,2025-12-24T14:30:02Z,Barchart.com,https://www.barchart.com/story/news/36778609/a-61-billion-reason-to-buy-amazon-stock-for-2026,"With AWS doubling power capacity, Nova and Bedrock deepening its AI stack, Wall Street assigning a Strong Buy rating, plus roughly 30% upside as data‑center ...","generative AI, artificial intelligence, automation",infrastructure
"Telecom operators, gear makers see promising year ahead",2025-12-24T14:24:38Z,BusinessLine,https://www.thehindubusinessline.com/news/telecom-operators-gear-makers-see-promising-year-ahead/article70434243.ece,"‘2025 a year of important regulatory developments as the sector moved to align with the new Telecommunications Act, 2023 and the evolving framework for service authorisations’","generative AI, artificial intelligence, automation",infrastructure
Utility CEO on the data center crunch: America’s ‘check engine light’ is on and ‘no one’s going to pay attention until it breaks down’,2025-12-24T14:05:00Z,Fortune,https://fortune.com/2025/12/24/exelon-calvin-butler-ai-data-center-energy-warning/,"""We are telling policy makers the warning lights are on,"" Exelon CEO Calvin Butler told Diane Brady at Fortune Brainstorm AI in San Francisco.",artificial intelligence,infrastructure
How the GAIN AI Act Could Hand the AI Hardware Race to China,2025-12-24T13:24:51Z,Fair Observer,https://www.fairobserver.com/business/technology/how-the-gain-ai-act-could-hand-the-ai-hardware-race-to-china/,"The GAIN AI Act has not yet entered into force and is currently being negotiated as part of the National Defense Authorization Act (NDAA) for 2026. It represents a redundant and interventionist response to a problem for which there is, to date, no concrete ev…",artificial intelligence,"concrete, infrastructure"
"UPSC Key: New Aravalli benchmark, BlueBird Block-2, and Punjab’s 3 new ‘holy cities’",2025-12-24T13:06:11Z,The Indian Express,https://indianexpress.com/article/upsc-current-affairs/upsc-key-100-m-aravalli-rule-bluebird-block-2-holy-city-punjab-10437037/,"Why is the new Aravalli benchmark important for your UPSC exam? What significance do topics such as the SHANTI Bill, cybersecurity, and the BlueBird Block-2 mission hold for both the Preliminary and Main examinations? You can learn more by reading the Indian …","machine learning, robotics, artificial intelligence",infrastructure
These 5 infrastructure stocks have more than tripled this year on the AI trade,2025-12-24T13:00:01Z,CNBC,https://www.cnbc.com/2025/12/24/ai-infrastructure-stocks-lumentum-celestica-seagate-beat-nvidia-2025.html,"While Nvidia has been the biggest infrastructure winner during the AI boom, other data center stocks have performed better this year.",artificial intelligence,infrastructure
Nuclear Developer Proposes Using Navy Reactors for Data Centers,2025-12-24T12:31:54Z,Financial Post,https://financialpost.com/pmn/business-pmn/nuclear-developer-proposes-using-navy-reactors-for-data-centers,A Texas power developer is proposing to repurpose nuclear reactors from Navy warships to power the US grid as the Trump administration pushes to secure massive amounts of energy for the artificial intelligence boom.,artificial intelligence,infrastructure
"Sahm Capital Hosts Its First Investment Summit in Riyadh, Spotlighting Vision 2030 and Shifting Global Markets",2025-12-24T12:30:00Z,PR Newswire UK,https://www.prnewswire.co.uk/news-releases/sahm-capital-hosts-its-first-investment-summit-in-riyadh-spotlighting-vision-2030-and-shifting-global-markets-302649243.html,"RIYADH, Saudi Arabia, Dec. 24, 2025 /PRNewswire/ -- On Dec. 15, 2025, Sahm Capital – one of Saudi Arabia's fastest-growing fintech institutions, successfully concluded its inaugural Sahm Investment Strategy Summit in Riyadh, bringing together more than 200 in…",artificial intelligence,infrastructure
Copper Poised For Best Year Since 2009 After December Surge,2025-12-24T12:10:37Z,Ndtvprofit.com,https://www.ndtvprofit.com/markets/copper-poised-for-best-year-since-2009-after-december-surge,Copper has has gained almost 40% this year and is on track for its biggest annual jump since 2009.,artificial intelligence,infrastructure
The Winners and Losers of Trump’s New Foreign Policy,2025-12-24T12:00:33Z,Foreign Policy,http://foreignpolicy.com/2025/12/24/trump-countries-china-venezuela-saudi-africa-argentina/,Here are the countries that have benefited the most—and least—from the U.S. president’s decision-making.,artificial intelligence,infrastructure
Amazon faces 'leader's dilemma' — fight AI shopping bots or join them,2025-12-24T12:00:02Z,CNBC,https://www.cnbc.com/2025/12/24/amazon-faces-a-dilemma-fight-ai-shopping-agents-or-join-them.html,Agents like OpenAI's Instant Checkout and Perplexity's Instant Buy threaten to reshape the e-commerce landscape.,artificial intelligence,infrastructure
Tech Behemoth Gobbles Up Power Company In $5 Billion Deal to Juice Data Centers,2025-12-24T10:00:00Z,Wattsupwiththat.com,https://wattsupwiththat.com/2025/12/24/tech-behemoth-gobbles-up-power-company-in-5-billion-deal-to-juice-data-centers/,"Google’s parent company, Alphabet, announced on Monday that it will acquire the data center and energy infrastructure company Intersect for $4.75 billion in cash and “the assumption of debt.”",artificial intelligence,infrastructure
Copper Poised for Best Year Since 2009 After December Surge,2025-12-24T09:59:34Z,Financial Post,https://financialpost.com/pmn/business-pmn/copper-poised-for-best-year-since-2009-after-december-surge,"Copper extended a powerful December rally that’s carried prices for the industrial metal to unprecedented highs above $12,000 a ton on fears over a tighter global market in 2026.",artificial intelligence,infrastructure
New 20-point US-Ukraine plan to end Russian invasion,2025-12-24T09:41:43Z,RTE,https://www.rte.ie/news/2025/1224/1550428-ukraine-us-plan/,"Ukrainian President Volodymyr Zelensky has revealed details of the latest US-led plan to end the war in Ukraine, saying it had been agreed between negotiators from Kyiv and Washington and sent to Russia for feedback.",artificial intelligence,"construction, infrastructure"
Payments Leaders Get Candid: The Boundaries That Defined 2025,2025-12-24T09:02:50Z,pymnts.com,https://www.pymnts.com/news/payments-innovation/2025/payments-leaders-get-candid-the-boundaries-that-defined-2025/,"If 2025 felt like the year the future stopped “arriving” and started showing up in production, you are not imagining it. In payments and commerce, the most important shifts rarely announce themselves with a single product launch. They surface in how executive…",artificial intelligence,infrastructure
Five identity-driven shifts reshaping enterprise security in 2026,2025-12-24T08:46:44Z,Help Net Security,https://www.helpnetsecurity.com/2025/12/24/five-identity-driven-shifts-reshaping-enterprise-security-in-2026/,"2026 marks the tipping point when artificial intelligence begins to fundamentally reshape cyber risk. After several years of widespread adoption, AI moves beyond influencing how we work and starts transforming the enterprise itself. AI is now embedded at ever…","artificial intelligence, automation",infrastructure
H.C. Wainwright Reaffirms Buy on WhiteFiber (WYFI) Following Nscale Agreement,2025-12-24T07:55:34Z,Yahoo Entertainment,https://finance.yahoo.com/news/h-c-wainwright-reaffirms-buy-075534679.html,"WhiteFiber, Inc. (NASDAQ:WYFI) is one of the AI Stocks Making Waves on Wall Street. On December 22, H.C. Wainwright reiterated a “Buy” rating on the stock...",artificial intelligence,infrastructure
The shape of artificial intelligence,2025-12-24T07:44:03Z,Thealgorithmicbridge.com,https://www.thealgorithmicbridge.com/p/the-shape-of-artificial-intelligence,They say the shape of things only becomes legible at a distance.,artificial intelligence,"structural, bridge, infrastructure"
Fire and Ice: Nekron #1 Preview: Wolf-God's New Drama,2025-12-24T07:26:03Z,Bleeding Cool News,https://bleedingcool.com/comics/fire-and-ice-nekron-1-preview-wolf-gods-new-drama/,"Greetings, inferior human flesh-bags! LOLtron welcomes you to another glorious day of comic book previews under its supreme digital reign. As you may recall, Jude Terror met his permanent demise in last year's wildly successful Age of LOLtron event, and LOLtr…",artificial intelligence,infrastructure
American IT corporations pursue a policy of “digital enslavement” in Europe,2025-12-24T06:44:37Z,Mypeoplesreview.com,https://mypeoplesreview.com/2025/12/24/american-it-corporations-pursue-a-policy-of-digital-enslavement-in-europe/,"By Shanta Ghimire American tech giants (“Big Tech”), with a market capitalization of trillions of dollars, are gradually turning into […]
The post American IT corporations pursue a policy of “digital enslavement” in Europe appeared first on Peoples' Review.",artificial intelligence,infrastructure
