title,publication_date,source,url,description,ai_keywords_found,ce_keywords_found
pct-eval added to PyPI,2025-12-19T05:52:30Z,Pypi.org,https://pypi.org/project/pct-eval/,Accurate Pentagon Copying Test (PCT) evaluation using Combinatorial Optimization and Geometric Theory,computer vision,structural
Superior transplant recipient outcome prediction and pathology assessment using rapid deep learning applied to procurement kidney biopsies,2025-12-14T00:00:00Z,Nature.com,https://www.nature.com/articles/s41598-025-31667-x,Scientific Reports - Superior transplant recipient outcome prediction and pathology assessment using rapid deep learning applied to procurement kidney biopsies,"computer vision, machine learning, neural networks, artificial intelligence",structural
R2GDN: RepGhost based residual dense network for image super-resolution,2025-12-12T14:00:00Z,Plos.org,https://journals.plos.org/plosone/article?id=10.1371/journal.pone.0338432,This study introduces a novel lightweight image super-resolution reconstruction network aimed at mitigating the challenges associated with computational complexity and memory consumption in existing super-resolution reconstruction networks. The proposed netwo…,"computer vision, neural networks","structural, construction"
A unified multi-task learning framework for automated assessment of left ventricular structure and its systolic function from echocardiography,2025-12-12T00:00:00Z,Nature.com,https://www.nature.com/articles/s41598-025-31773-w,The manual assessment of Left Ventricular (LV) structure and its systolic function from echocardiography is fundamental for cardiovascular diagnosis but is often time-consuming and subject to inter-observer variability. While deep learning has advanced the au…,"neural networks, machine learning, automation, artificial intelligence, computer vision",structural
A deep learning approach for time-consistent cell cycle phase prediction from microscopy data,2025-12-11T14:00:00Z,Plos.org,https://journals.plos.org/ploscompbiol/article?id=10.1371/journal.pcbi.1013800,"Author summary The cell cycle is a fundamental biological process involving distinct stages of growth, DNA replication, and division. Understanding which stage a cell is in can help researchers study many biological phenomena, including how cells respond to t…","computer vision, neural networks, machine learning","structural, construction"
Whole Milk Powder Market Size to Worth USD 27.27 Billion by 2035 | Towards FnB,2025-12-11T10:13:00Z,GlobeNewswire,https://www.globenewswire.com/news-release/2025/12/11/3203713/0/en/Whole-Milk-Powder-Market-Size-to-Worth-USD-27-27-Billion-by-2035-Towards-FnB.html,"According to Towards FnB, the global whole milk powder market size is evaluated at USD 20.54 billion in 2026 and is anticipated to surge USD 27.27 billion by 2035, reflecting at a CAGR of 3.2% from 2026 to 2035. This growth is being driven by increasing consu…","computer vision, artificial intelligence","structural, transportation, infrastructure"
Barley Flakes Market Size to Worth USD 15.30 Billion by 2034 | Towards FnB,2025-12-11T10:06:00Z,GlobeNewswire,https://www.globenewswire.com/news-release/2025/12/11/3203710/0/en/Barley-Flakes-Market-Size-to-Worth-USD-15-30-Billion-by-2034-Towards-FnB.html,"According to Towards FnB, the global barley flakes market size is evaluated at USD 10.39 billion in 2025 and is anticipated to hit USD 15.30 billion by 2034, reflecting at a CAGR of 4.4% from 2025 to 2034. This forecast signals steady market momentum driven b…","computer vision, machine learning, artificial intelligence","structural, infrastructure"
Computational whole-body-exposome models for global precision brain health,2025-12-11T00:00:00Z,Nature.com,https://www.nature.com/articles/s41467-025-67448-3,"Ibanez et al. introduce multimodal diversity, a synergistic framework integrating multimodal brain metrics, whole-body health, and exposomic data through neurosyndemic computational modeling to advance context-sensitive precision brain health across global se…","computer vision, machine learning, neural networks, artificial intelligence","structural, concrete, bridge, infrastructure"
Development of a high-precision nano millimeter-wave radar system for non-contact bridge displacement monitoring,2025-12-11T00:00:00Z,Nature.com,https://www.nature.com/articles/s41598-025-31631-9,Scientific Reports - Development of a high-precision nano millimeter-wave radar system for non-contact bridge displacement monitoring,computer vision,"structural, concrete, bridge, transportation"
Non-Dairy Butter Market to Experience Unstoppable Growth at a CAGR of 13.9% | Towards FnB,2025-12-10T11:27:00Z,GlobeNewswire,https://www.globenewswire.com/news-release/2025/12/10/3203014/0/en/Non-Dairy-Butter-Market-to-Experience-Unstoppable-Growth-at-a-CAGR-of-13-9-Towards-FnB.html,"According to Towards FnB, the global non-dairy butter market size is evaluated at USD 1.23 billion in 2025 and is anticipated to surge USD 3.97 billion by 2034, reflecting at an impressive CAGR of 13.9% from 2025 to 2034. This growth is fueled by the rising d…","computer vision, machine learning, artificial intelligence","structural, infrastructure"
Development of a mechatronic weft selector to enhance patterning capacity in Rapier looms,2025-12-09T14:00:00Z,Plos.org,https://journals.plos.org/plosone/article?id=10.1371/journal.pone.0338603,"Rapier weaving machines are widely used in the weaving industry; however, the design of the current weft selectors limits their capability to produce fabrics incorporating a large variety of weft yarns. Nevertheless, increasing the number of wefts with the ex…","computer vision, machine learning, automation","structural, bridge"
Image-processing pipeline for diagnosing diabetic macular ischaemia in diabetic macular oedema,2025-12-09T00:00:00Z,Nature.com,https://www.nature.com/articles/s41598-025-30721-y,Scientific Reports - Image-processing pipeline for diagnosing diabetic macular ischaemia in diabetic macular oedema,computer vision,structural
SlingBAG: point cloud-based iterative algorithm for large-scale 3D photoacoustic imaging,2025-12-06T00:00:00Z,Nature.com,https://www.nature.com/articles/s41467-025-66855-w,"Researchers present SlingBAG, an iterative reconstruction algorithm for large-scale 3D photoacoustic imaging. It uses an adaptive point cloud model to achieve high-quality imaging from sparse data, notably cutting cost in both memory and time.",computer vision,"structural, construction"
Early damage detection in bridges using a variational autoencoder–based hybrid unsupervised learning framework,2025-12-04T00:00:00Z,Nature.com,https://www.nature.com/articles/s41598-025-31115-w,Scientific Reports - Early damage detection in bridges using a variational autoencoder–based hybrid unsupervised learning framework,"computer vision, machine learning, neural networks, artificial intelligence","structural, construction, bridge, concrete"
Intra-scale interaction and cross-scale fusion network for detecting the progression of neurodegeneration in Alzheimer’s disease,2025-12-04T00:00:00Z,Nature.com,https://www.nature.com/articles/s41598-025-31179-8,"Alzheimer’s disease (AD), one of the most widespread neurodegenerative disorders, can be mitigated through early recognition and treatment. Recent research has shown that multimodal fusion is effective for the early-stage diagnosis of AD. However, most existi…","computer vision, neural networks, machine learning",structural
Forecast for Artificial Intelligence (AI) in Drones is Extraordinarily Robust with Market Projected to Triple in Value by 2030,2025-12-03T13:45:00Z,GlobeNewswire,https://www.globenewswire.com/news-release/2025/12/03/3198907/0/en/Forecast-for-Artificial-Intelligence-AI-in-Drones-is-Extraordinarily-Robust-with-Market-Projected-to-Triple-in-Value-by-2030.html,"MarketNewsUpdates News Commentary  NEW YORK, Dec.  03, 2025  (GLOBE NEWSWIRE) -- Artificial Intelligence (AI) is reportedly transforming drones and......","computer vision, artificial intelligence","structural, infrastructure"
Built environment disparities are amplified during extreme weather recovery,2025-12-03T00:00:00Z,Nature.com,https://www.nature.com/articles/s41586-025-09804-3,Higher-income neighbourhoods rebuild and improve after disasters while lower-income areas do not return to pre-disaster conditions.,"computer vision, machine learning","structural, construction, infrastructure"
A multi scale spatial attention based zero shot learning framework for low light image enhancement,2025-12-03T00:00:00Z,Nature.com,https://www.nature.com/articles/s41598-025-30479-3,Scientific Reports - A multi scale spatial attention based zero shot learning framework for low light image enhancement,"computer vision, neural networks, artificial intelligence",structural
Atom-level enzyme active site scaffolding using RFdiffusion2,2025-12-03T00:00:00Z,Nature.com,https://www.nature.com/articles/s41592-025-02975-x,"RFdiffusion2, an extension of the RFdiffusion framework, builds de novo enzyme active sites using atom-level functional group constraints.","computer vision, machine learning",structural
Ju-LiteMobileAtt: A lightweight attention network for efficient jujube defect classification,2025-12-02T14:00:00Z,Plos.org,https://journals.plos.org/plosone/article?id=10.1371/journal.pone.0337898,"Surface defect detection of organic jujubes is critical for quality assessment. However, conventional machine vision lacks adaptability to polymorphic defects, while deep learning methods face a trade-off—deep architectures are computationally intensive and u…","computer vision, neural networks, machine learning",structural
Artificial intelligence foundation model automates cryo-EM structure determination,2025-12-01T00:00:00Z,Nature.com,https://www.nature.com/articles/s41592-025-02917-7,"We introduce the Cryo-EM Image Evaluation Foundation (Cryo-IEF) model, which has been pretrained on 65 million particle images in an unsupervised manner. Cryo-IEF excels in diverse cryogenic electron microscopy data-processing tasks; it automates the complex …",artificial intelligence,structural
A comprehensive foundation model for cryo-EM image processing,2025-11-27T00:00:00Z,Nature.com,https://www.nature.com/articles/s41592-025-02916-8,"Cryo-IEF is a pre-trained foundation model for performing diverse image-processing tasks in single-particle cryo-EM. CryoWizard, enabled by Cryo-IEF, is a fully automated cryo-EM processing pipeline.","computer vision, machine learning, neural networks, artificial intelligence","structural, construction"
Deep learning classification of INSV-associated weeds in Monterey county using a curated RGB image dataset,2025-11-26T00:00:00Z,Nature.com,https://www.nature.com/articles/s41598-025-29552-8,Scientific Reports - Deep learning classification of INSV-associated weeds in Monterey county using a curated RGB image dataset,"computer vision, machine learning, neural networks, artificial intelligence","structural, bridge"
Effectiveness of YOLO variants for small object detection in SAR images using a new dataset,2025-11-26T00:00:00Z,Nature.com,https://www.nature.com/articles/s41598-025-28755-3,Scientific Reports - Effectiveness of YOLO variants for small object detection in SAR images using a new dataset,"computer vision, neural networks","structural, construction"
Larry Ellison’s $40 billion pledge to his son’s Paramount deal shows a shift in billionaire giving: Philanthropic capitalism is taking over,2025-12-23T18:39:26Z,Fortune,https://fortune.com/2025/12/23/larry-ellison-40-billion-pledge-son-paramount-philanthropy-capitalism/,"Ellison has pledged to give away 95% of his fortune, but the recent move shows a new playbook.",generative AI,"structural, infrastructure"
Climate Rising: Extending Apparel Lifespan with ThredUp,2025-12-23T13:10:00Z,Harvard Business Review,https://hbr.org/podcast/2025/12/climate-rising-extending-apparel-lifespan-with-thredup,"The business model, brand strategy, and AI tools powering one of the largest secondhand clothing platforms.","generative AI, automation","structural, infrastructure"
"""Horrible"", ""boring"", and ""cheap"": Experts pan new chatbot NPCs, but some leave room for optimism",2025-12-23T13:00:00Z,Rock Paper Shotgun,https://www.rockpapershotgun.com/horrible-boring-and-cheap-experts-pan-new-chatbot-npcs-but-some-leave-room-for-optimism,"This year, generative AI seeped into mainstream gaming. Though it didn't so much shimmer, as smear. It mispronounced lines in Arc Raiders, ""drew"" a smudgy loading screen in Anno 117, voiced a sweary Darth Vader in Fortnite – perhaps its least subtle appearanc…",generative AI,structural
2025 in review: an interesting year,2025-12-23T11:00:45Z,Werd.io,https://werd.io/2025-in-review-an-interesting-year/,"On fascism, technology, and finding the helpers.",generative AI,"structural, concrete, infrastructure"
In 2025 Card Networks Reshaped Commerce While Banks Rewired Payments,2025-12-23T09:01:45Z,pymnts.com,https://www.pymnts.com/connectedeconomy/2025/in-2025-card-networks-reshaped-commerce-while-banks-rewired-payments/,"If there was a single through line in PYMNTS’ 2025 conversations with the major card networks, banks and FinTechs, it was that “payments” is no longer treated as a discrete function. It is increasingly positioned as an always-on operating system for commerce—…","generative AI, automation","structural, infrastructure"
Ad Tech Briefing: Big Tech won 2025 (even when it lost),2025-12-23T05:01:00Z,Digiday,http://digiday.com/media-buying/ad-tech-briefing-big-tech-won-2025-even-when-it-lost/,"Google was the main beneficiary of how 2025 went down, according to sources, even with the government against it.","generative AI, automation","structural, infrastructure"
"Global Times: Advances in digital economy, innovation and industrial upgrading underpin confidence in China’s economic resilience, growth potential",2025-12-22T21:28:00Z,GlobeNewswire,https://www.globenewswire.com/news-release/2025/12/22/3209563/0/en/Global-Times-Advances-in-digital-economy-innovation-and-industrial-upgrading-underpin-confidence-in-China-s-economic-resilience-growth-potential.html,"China’s 2025 CEWC set priorities for innovation, domestic demand and opening-up, guiding stable growth and high-quality development into 2026. China’s 2025 CEWC set priorities for innovation, domestic demand and opening-up, guiding stable growth and high-qual…","generative AI, robotics",structural
ChatGPT faces murder charges in court,2025-12-20T14:47:00Z,Notebookcheck.net,https://www.notebookcheck.net/ChatGPT-faces-murder-charges-in-court.1189770.0.html,"A US lawsuit alleges that OpenAI and Microsoft used ChatGPT in a manner that exacerbated a perpetrator’s psychosis, indirectly contributing to a fatal crime. The case’s outcome could play a crucial role in shaping how AI companies are held accountable in comp…",generative AI,structural
6 Cybersecurity Predictions for the AI Economy in 2026 - SPONSOR CONTENT FROM PALO ALTO NETWORKS,2025-12-19T20:50:48Z,Harvard Business Review,https://hbr.org/sponsored/2025/12/6-cybersecurity-predictions-for-the-ai-economy-in-2026,Sponsor Content from Palo Alto Networks.,"generative AI, automation","structural, infrastructure"
Perplexity SEO Services Launched – NEWMEDIA.COM Leading AEO Agency For Brands Announces New RankOS™ Framework for Top AI Search Rankings,2025-12-19T16:03:00Z,GlobeNewswire,https://www.globenewswire.com/news-release/2025/12/19/3208622/0/en/Perplexity-SEO-Services-Launched-NEWMEDIA-COM-Leading-AEO-Agency-For-Brands-Announces-New-RankOS-Framework-for-Top-AI-Search-Rankings.html,Perplexity SEO search visibility improves as NEWMEDIA.COM launches RankOS™ to help brands earn citation in answer-engine results....,generative AI,structural
"Friday links: December 19, 2025",2025-12-19T11:00:47Z,Werd.io,https://werd.io/friday-links-december-19-2025/,Predictions for journalism; paperbacks are dead; feeling the fear.,generative AI,"structural, infrastructure"
"""Robot, make me a chair"" robot-make-me-a-chair-in-six-prompts",2025-12-19T09:54:47Z,Space Daily,https://www.spacedaily.com/reports/Robot_make_me_a_chair_999.html,"Boston MA (SPX) Dec 17, 2025


Computer-aided design (CAD) systems are tried-and-true tools used to design many of the physical objects we use each day. But CAD software requires extensive expertise to master, and many tools incorporate such a high level of d…","generative AI, artificial intelligence, robotics","structural, concrete"
"Who Benefits When The Line Between SEO And GEO Is Blurred via @sejournal, @DuaneForrester",2025-12-18T14:30:10Z,Search Engine Journal,https://www.searchenginejournal.com/who-benefits-when-the-line-between-seo-and-geo-is-blurred/563231/,"SEO still matters, but Duane Forrester explains how answer-driven systems change the work, the metrics, and the path to influence.
The post Who Benefits When The Line Between SEO And GEO Is Blurred appeared first on Search Engine Journal.",generative AI,structural
Top 3 U.S. Dividend Stocks for 2026,2025-12-18T10:30:00Z,Thedividendguyblog.com,https://thedividendguyblog.com/top-us-stocks/,"A few days ago, I released my Top 3 Canadian Dividend Stocks for 2026, along with a quick market recap showing why the TSX quietly outperformed the S&P 500 in 2025. If you missed that one, you can read it here. Today, we’re shifting gears. Let’s look south an…",generative AI,"structural, infrastructure"
Roundup: Streaming Industry Predictions for 2026,2025-12-18T09:35:00Z,Streamingmedia.com,https://www.streamingmedia.com/Articles/ReadArticle.aspx?ArticleID=172903,"The predictions game is a fascinating one, and one that's hard not to play at year's end, whether we're talking about what's to come in the next year or three, or what's just as likely to be gone. In the last few weeks, my own editorial inbox has filled to bu…","generative AI, automation","structural, tunnel, infrastructure"
High temperature evaporative cooler utilizing boiling suppression at water’s boiling point,2025-12-18T00:00:00Z,Nature.com,https://www.nature.com/articles/s41467-025-67717-1,"The authors demonstrate boiling suppression in a water film confined within nano/micro-structured surfaces, enabling steam generation at the boiling point without bubble formation. Leveraging this discovery, they develop a dew-point evaporative cooler capable…","generative AI, artificial intelligence","structural, tunnel"
Enterprise AI moves from pilots to production as HPE tackles the execution problem,2025-12-17T19:52:53Z,SiliconANGLE News,https://siliconangle.com/2025/12/17/enterprise-ai-hpe-tackles-execution-problem-hpeaimomentum/,"Enterprise AI has entered a new phase — one defined less by experimentation and more by execution. Across industries, organizations are discovering that moving AI from pilot projects into production-grade systems is not a modeling problem, but an operational …","generative AI, automation","structural, infrastructure"
AI tools are being used to subject women in public life to online violence,2025-12-17T17:34:29Z,The Conversation Africa,https://theconversation.com/ai-tools-are-being-used-to-subject-women-in-public-life-to-online-violence-271703,"As digital technology becomes ever more sophisticated, AI tools are increasingly being used to target woment with abusive and misogynistic onine content.",generative AI,structural
ChatGPT SEO Agency NEWMEDIA.COM Launches RankOS™ Framework to Provide AI Search Ranking Services To Brands,2025-12-17T16:39:00Z,GlobeNewswire,https://www.globenewswire.com/news-release/2025/12/17/3207178/0/en/ChatGPT-SEO-Agency-NEWMEDIA-COM-Launches-RankOS-Framework-to-Provide-AI-Search-Ranking-Services-To-Brands.html,NEWMEDIA.COM expands RankOS™ to help brands improve visibility and citation within ChatGPT and other conversational AI platforms....,generative AI,structural
Chatbot visibility startup geoSurge launches to help brands get noticed by ChatGPT,2025-12-17T14:00:36Z,SiliconANGLE News,https://siliconangle.com/2025/12/17/chatbot-visibility-startup-geosurge-launches-help-brands-get-noticed-chatgpt/,So-called generative engine optimization startup geoSurge Ltd. is launching today to help brands ensure they can remain visible to generative artificial intelligence chatbots like ChatGPT. The company said it’s pioneering an entirely new discipline it has chr…,"generative AI, artificial intelligence",structural
The Deepfake Reckoning: Why Crypto’s Next Security Battle Will Be Against Synthetic Humans,2025-12-17T14:00:00Z,CoinDesk,https://www.coindesk.com/opinion/2025/12/16/the-deepfake-reckoning-why-crypto-s-next-security-battle-will-be-against-synthetic-humans,"Crypto platforms must adopt proactive, multi-layered verification architectures that don’t stop at onboarding but continuously validate identity, intent, and transaction integrity throughout the user journey, argues Ilya Broven, chief growth officer at Sumsub.",generative AI,"structural, infrastructure"
Resisting Silicon Valley's hegemony with rice-paddy logic,2025-12-16T07:13:21Z,Antaranews.com,https://en.antaranews.com/news/396652/resisting-silicon-valleys-hegemony-with-rice-paddy-logic,Reality on the ground often speaks with a gravelly voice that drowns out the polished narratives of the world&#39;s tech capitals. From the rice paddies of ...,generative AI,"structural, concrete, infrastructure"
"“Robot, make me a chair”",2025-12-16T05:00:00Z,Mit.edu,https://news.mit.edu/2025/robot-makes-chair-1216,A generative AI-driven system enables non-experts to design and build common objects like furniture simply by describing the objects with words.,"generative AI, artificial intelligence, robotics",structural
"Pressured by chatbots, newsrooms push past the one-story-fits-all model",2025-12-15T20:17:26Z,Niemanlab.org,https://www.niemanlab.org/2025/12/pressured-by-chatbots-newsrooms-push-past-the-one-story-fits-all-model/,"This annual feature has always focused on what happens to journalism, but the better question might be what’s happening to audiences. Because they’re changing, and quickly. Are we ready to adapt? Chatbots are coming to news — strike that; they’re here already…",generative AI,structural
Your programming career isn't over - AI just upgraded your toolbox,2025-12-15T16:51:38Z,ZDNet,https://www.zdnet.com/article/ai-gives-programmers-power-tools/,"Now that AI can write software, where does that leave you as a programmer? The answer lies in the past.","generative AI, automation",structural
What makes a good proton conductor?,2025-12-15T16:00:00Z,Mit.edu,https://news.mit.edu/2025/what-makes-good-proton-conductor-1215,"MIT researchers created a way to predict how efficiently materials can transfer protons in clean energy, low-power computing devices and other advanced technologies.","generative AI, artificial intelligence",structural
Biologics CDMO Market Size Expected to Hit USD 92.37 Billion by 2034 Fueled by Rising Demand for Monoclonal Antibodies and Biosimilars,2025-12-15T15:14:00Z,GlobeNewswire,https://www.globenewswire.com/news-release/2025/12/15/3205587/0/en/Biologics-CDMO-Market-Size-Expected-to-Hit-USD-92-37-Billion-by-2034-Fueled-by-Rising-Demand-for-Monoclonal-Antibodies-and-Biosimilars.html,"According to Precedence Research, the global biologics CDMO market size will grow from USD 25.35 billion in 2025 to nearly USD 92.37 billion by 2034, with an expected CAGR of 15.45% from 2025 to 2034. North America led the biologics CDMO market with a 36% sha…","generative AI, automation","structural, infrastructure"
From Impressions to Impact – the Year of Outcomes?,2025-12-15T09:25:08Z,ExchangeWire,https://www.exchangewire.com/blog/2025/12/15/from-impressions-to-impact-the-year-of-outcomes/,"Next up in our predictions series, we look at the importance of outcomes, and how they could come to define 2026…
Are we moving from vanity metrics to meaningful measurement? 2026 could become the defining moment for outcomes-based thinking. After years [...]…",generative AI,"structural, infrastructure"
AI Favors Ecommerce Giants — for Now,2025-12-14T18:40:59Z,Practical Ecommerce,https://www.practicalecommerce.com/ai-favors-ecommerce-giants-—-for-now,"AI models rely on ""trusted"" enterprise sources, yet providers are emerging for SMBs.
The post AI Favors Ecommerce Giants — for Now appeared first on Practical Ecommerce.","generative AI, artificial intelligence","structural, infrastructure"
AI Favors Ecommerce Giants — for Now,2025-12-14T18:40:59Z,Practical Ecommerce,https://www.practicalecommerce.com/ai-favors-ecommerce-giants-for-now,"AI models rely on ""trusted"" enterprise sources, yet providers are emerging for SMBs.
The post AI Favors Ecommerce Giants — for Now appeared first on Practical Ecommerce.","generative AI, artificial intelligence","structural, infrastructure"
AI Chip Market to Explode to $565 Billion by 2032,2025-12-12T20:00:00Z,OilPrice.com,https://oilprice.com/Finance/the-Markets/AI-Chip-Market-to-Explode-to-565-Billion-by-2032.html,"The global market for artificial intelligence (AI) chips is projected to skyrocket from $203.24 billion in 2025 to nearly $565 billion by 2032, driven by an insatiable demand for real-time analytics and generative AI capabilities.  According to a new report b…","automation, generative AI, artificial intelligence, robotics","structural, infrastructure"
New AI Tool Promises to Decode—And Replicate—Social Video Virality,2025-12-12T18:48:11Z,Decrypt,https://decrypt.co/352167/new-ai-tool-promises-decode-replicate-social-media-virality,"The startup says its AI can analyze viral videos and generate optimized remixes, though evidence beyond early demos remains limited.",generative AI,structural
