title,publication_date,source,url,description,ai_keywords_found,ce_keywords_found
Indians choosing independence as 'founder' numbers soar: LinkedIn Report,2025-12-04T06:41:58Z,The Times of India,https://economictimes.indiatimes.com/news/company/corporate-trends/indians-choosing-independence-as-founder-numbers-soar-linkedin-report/articleshow/125760280.cms,"Seven in ten Indian professionals aspire to work for themselves by 2026, fueled by AI's role in simplifying business operations. LinkedIn reports a significant rise in ""founder"" profiles and AI adoption, with 82% of leaders finding it crucial for growth and 8…","generative AI, artificial intelligence",concrete
“We are building a tech bridge between Russia and India”—Herman Gref of Sberbank on bilateral tech ties,2025-12-03T05:56:58Z,The Times of India,https://economictimes.indiatimes.com/news/international/world-news/we-are-building-a-tech-bridge-between-russia-and-indiaherman-gref-of-sberbank-on-bilateral-tech-ties/articleshow/125734817.cms,"Sberbank CEO Herman Gref highlights Russia's leadership in payment technologies and generative AI, emphasizing unique solutions like biometric payments and the open-source GigaChat model. He discusses collaborations with India, the development of AI robots, a…",generative AI,bridge
5 Strategies to Learn Better with AI (and Traps to Avoid),2025-12-02T16:15:12Z,Scotthyoung.com,https://www.scotthyoung.com/blog/2025/12/02/5-strategies-to-learn-better-with-ai-and-traps-to-avoid/,"Recently, I shared my predictions about how AI will change the process of learning. In short, I expect that AI will reduce the need for many skills, potentially dumbing down the typical user. Just as the invention of writing made us worse at remembering thing…",generative AI,concrete
The effects of ideology and cognitive reflection on evidence gathering behavior in the political domain,2025-12-02T14:00:00Z,Plos.org,https://journals.plos.org/plosone/article?id=10.1371/journal.pone.0338088,"This paper explores individual-level standards of evidence in the political domain. In particular, we examine why people rely on different types of evidence in their evaluations of causal claims. Our empirical analysis is based on original survey data collect…","generative AI, artificial intelligence","construction, bridge, concrete"
"The Cloud’s Not Fluffy, It’s a Hot, Loud, Energy-Voracious Factory",2025-12-02T07:44:32Z,Nakedcapitalism.com,https://www.nakedcapitalism.com/2025/12/the-clouds-not-fluffy-its-a-hot-loud-energy-voracious-factory.html,A more detailed look at why to resist massive pressures for data center buildout and question claims of inevitability.,"generative AI, artificial intelligence","structural, concrete, infrastructure"
Capgemini develops agentic AI solution to support UNICEF in improving youth access to green careers,2025-12-02T07:30:00Z,GlobeNewswire,https://www.globenewswire.com/news-release/2025/12/02/3197608/0/en/Capgemini-develops-agentic-AI-solution-to-support-UNICEF-in-improving-youth-access-to-green-careers.html,"Capgemini develops agentic AI solution to support UNICEF in improving youth access to green careers

......",generative AI,"concrete, bridge, infrastructure"
"The Cloud’s Not Fluffy, It’s a Hot, Loud Factory",2025-11-27T19:00:00Z,OilPrice.com,https://oilprice.com/Energy/Energy-General/The-Clouds-Not-Fluffy-Its-a-Hot-Loud-Factory.html,"The Cloud"" might be the greatest branding trick in history. It sounds fluffy, ethereal, and notably light. It implies that our digital lives…our emails, our crypto wallets, our endless scrolling…exist in some vaporous layer of the atmosphere, detached from ea…","generative AI, artificial intelligence","structural, concrete, infrastructure"
Account Behind Viral AI GTA 6 Bait Claims It Was ‘Just A Joke’,2025-11-26T22:16:36Z,Kotaku,https://kotaku.com/account-behind-viral-ai-gta-6-bait-claims-it-was-just-a-joke-2000647720,"An AI-generated video claiming to show off impressive GTA 6 graphics in action went viral this week
The post Account Behind Viral AI GTA 6 Bait Claims It Was ‘Just A Joke’ appeared first on Kotaku.",generative AI,concrete
AI Agents Aren’t Ready for Consumer-Facing Work—But They Can Excel at Internal Processes,2025-11-25T07:30:28Z,Harvard Business Review,https://hbr.org/2025/11/ai-agents-arent-ready-for-consumer-facing-work-but-they-can-excel-at-internal-processes,"Over the past two years, we’ve all heard a lot about generative AI. But for all of the hype about how it might change the business world, finding concrete examples of what it is doing right now isn’t always easy. More often, companies report struggling—and fa…",generative AI,concrete
"Analyzing Paper Reviews with LLMs: I Used ChatGPT, DeepSeek, Qwen, Mistral, Gemini, and Claude (and you should too + publish the analysis)",2025-12-03T00:00:00Z,R-bloggers.com,https://www.r-bloggers.com/2025/12/analyzing-paper-reviews-with-llms-i-used-chatgpt-deepseek-qwen-mistral-gemini-and-claude-and-you-should-too-publish-the-analysis/,"In the age of LLMs, leveraging their capabilities to analyze and interpret paper reviews can provide valuable insights. Here's how I used multiple LLMs to dissect the reviews I received for my recent submission.
Continue reading: Analyzing Paper Reviews with …",neural networks,concrete
Taiwan memory maker Etron finds AI growth path in drones and robotics,2025-12-19T06:47:31Z,Digitimes,https://www.digitimes.com/news/a20251219PD233/etron-robot-development-ces.html,"Etron's subsidiaries eYs3D Microelectronics, DeCloak and eEver Technology are beginning to translate years of technology investment into concrete AI applications, with early momentum emerging in robotics, drones and edge intelligence.",robotics,concrete
The Tim Ferriss Show Transcripts: Bill Gurley (#840),2025-12-18T04:32:46Z,Tim.blog,https://tim.blog/2025/12/17/bill-gurley-running-down-a-dream-transcript/,"Please enjoy this transcript of my interview with Bill Gurley, venture capitalist and general partner at Benchmark. We discuss investing in the AI era, 10 Days in China, important life lessons from Bob Dylan, Jerry Seinfeld, and MrBeast, and much more. Full b…",robotics,"concrete, bridge, infrastructure"
Europe picks its own lane at EFECS 2025 – Turning semiconductor strategy into competitive strength [Promoted Content],2025-12-17T14:00:17Z,EURACTIV,https://www.euractiv.com/opinion/europe-picks-its-own-lane-at-efecs-2025-turning-semiconductor-strategy-into-competitive-strength/,"Europe shifts from lofty ambitions to deliverables at EFECS 2025 – pilot lines, competence centres and cross-border collaboration emerge as practical outputs. The focus is on areas where Europe can lead, strengthening semiconductor competitiveness while Malta…","robotics, automation",concrete
In Defense of Matlab Code,2025-12-12T20:13:26Z,Runmat.org,https://runmat.org/blog/in-defense-of-matlab-whiteboard-style-code,"MATLAB still shines for math-heavy work. Its whiteboard-style syntax makes code easy to read, review, and run on modern tools like RunMat and fast GPUs.",robotics,"concrete, infrastructure"
Midea Built A Dr. Strange-inspired Multi-Arm Robot… Humanity Is Absolutely Cooked,2025-12-11T01:30:11Z,Yanko Design,https://www.yankodesign.com/2025/12/10/midea-built-a-dr-strange-inspired-multi-arm-robot-humanity-is-absolutely-cooked/,Midea Built A Dr. Strange-inspired Multi-Arm Robot… Humanity Is Absolutely CookedThere is a moment in Infinity War where Doctor Strange fans out into a halo of spectral arms and every animator in the room probably...,robotics,concrete
"Walmart and Alquist strike landmark deal, jump-starting 3D-printed commercial real estate",2025-12-10T13:00:01Z,CNBC,https://www.cnbc.com/2025/12/10/walmart-sika-3d-printed-real-estate.html,"The new technology has started to grow in the homebuilding market, but has been far slower in commercial construction.",robotics,"construction, concrete, infrastructure"
What If? AI in 2026 and Beyond,2025-12-08T17:58:15Z,Oreilly.com,https://www.oreilly.com/radar/what-if-ai-in-2026-and-beyond/#BlogPosting,"The market is betting that AI is an unprecedented technology breakthrough, valuing Sam Altman and Jensen Huang like demigods already astride the world. The slow progress of enterprise AI adoption from pilot to production, however, still suggests at least the …","robotics, automation","concrete, bridge, infrastructure"
Are We Testing AI’s Intelligence the Wrong Way?,2025-12-04T23:30:02Z,Ieee.org,https://spectrum.ieee.org/melanie-mitchell,"When people want a clear-eyed take on the state of artificial intelligence and what it all means, they tend to turn to Melanie Mitchell, a computer scientist and a professor at the Santa Fe Institute. Her 2019 book, Artificial Intelligence: A Guide for Thinki…","robotics, artificial intelligence",concrete
Alarming Video Shows Humanoid Robot Demon-Scuttling,2025-12-04T19:03:49Z,Futurism,https://futurism.com/robots-and-machines/alarming-video-shows-humanoid-robot-demon-scuttling,"""They're actually capable of way weirder stuff and way faster motions.""",robotics,concrete
Alarming Video Shows Humanoid Robot Demon-Scuttling,2025-12-04T19:03:49Z,Futurism,http://futurism.com/robots-and-machines/alarming-video-shows-humanoid-robot-demon-scuttling,"""They're actually capable of way weirder stuff and way faster motions.""
The post Alarming Video Shows Humanoid Robot Demon-Scuttling appeared first on Futurism.",robotics,concrete
MH370 mystery deepens: Pilot’s final 5 words revealed as new search kicks off,2025-12-04T15:38:24Z,The Times of India,https://economictimes.indiatimes.com/news/international/us/mh370-mystery-deepens-pilots-final-5-words-revealed-as-new-search-kicks-off/articleshow/125769197.cms,"Malaysia Airlines Flight 370 new search update: Malaysia Airlines Flight MH370 vanished in 2014 with 239 people aboard. Pilot Zaharie Ahmad Shah’s final words, 'Goodnight Malaysia three seven zero,' remain haunting. Over a decade later, Malaysia partners with…",robotics,concrete
Deep tech start-up Planys Technologies raises ₹100 crore for global expansion and launch of defence arm,2025-12-04T10:17:58Z,BusinessLine,https://www.thehindubusinessline.com/info-tech/deep-tech-start-up-planys-technologiesraises-100-crore-for-global-expansion-and-launch-of-defence-arm/article70357133.ece,"Planys Technologies secures ₹100 crore for global expansion and defence arm, planning a UUV production facility in Chennai.",robotics,"concrete, infrastructure"
Taiwan more than just a 'victim' of Chinese coercion: Hsiao,2025-12-03T09:34:19Z,Globalsecurity.org,https://www.globalsecurity.org/wmd/library/news/taiwan/2025/taiwan-251202-cna02.htm,"Taiwan is ""not just a victim"" of Chinese intimidation and coercion, but a proactive partner that can contribute to regional stability and the broader international community, Vice President Hsiao Bi-khim (蕭美琴) said in a recent interview with American podcast …",robotics,concrete
The race to AGI-pill the pope,2025-12-01T12:53:32Z,The Verge,https://www.theverge.com/ai-artificial-intelligence/829813/ai-agi-pope-leo,"Pope Leo XIV probably isn't the first person you picture when conversation turns to Artificial General Intelligence doomsday scenarios. But last month, AGI researcher John-Clark Levin found himself inside the Vatican on a mission to put those concerns in fron…",robotics,concrete
"SATURDAY SIX Presents: The 2025 Theme Park Turkeys, a Look Back at the CRAZIEST Theme Park Stories of the Year!",2025-11-29T13:00:13Z,Touringplans.com,https://touringplans.com/blog/saturday-six-presents-the-2025-theme-park-turkeys-a-look-back-at-the-craziest-theme-park-stories-of-the-year/,"This week’s SATURDAY SIX is an annual tradition like no other, as we proudly present the 12th Annual Theme Park Turkeys",robotics,"construction, concrete"
EIT launches ambitious ‘water knowledge community’ at EIT Awards,2025-11-27T03:44:26Z,EURACTIV,https://www.euractiv.com/news/eit-launches-ambitious-water-knowledge-community-at-eit-awards/,Europe’s standout innovators and entrepreneurial talents were honoured at the 2025 EIT Innovation Awards in Budapest,robotics,"concrete, bridge"
"Zipline to Triple Its Life-Saving Drone Delivery Network with $150 Million from U.S. State Department, that will be More than Doubled by African Countries",2025-11-25T11:01:00Z,GlobeNewswire,https://www.globenewswire.com/news-release/2025/11/25/3194141/0/en/Zipline-to-Triple-Its-Life-Saving-Drone-Delivery-Network-with-150-Million-from-U-S-State-Department-that-will-be-More-than-Doubled-by-African-Countries.html,Zipline to Triple Its Life-Saving Drone Delivery Network with $150 Million U.S. State Department Contract......,robotics,"construction, concrete, infrastructure"
Top Features to Look for in a Review Management Platform,2025-12-24T08:56:52Z,Ahouseinthehills.com,https://ahouseinthehills.com/top-features-to-look-for-in-a-review-management-platform/,"The current digital era has made customer opinions more valuable than ever before. Online reviews have become the key elements that influence consumer perceptions and even the rankings on search engines. As such, if you are the owner of a small business or th…",automation,concrete
Beatbot AquaSense 2 Pro Review: The 5-in-1 Pool Cleaner That Actually Delivers,2025-12-24T00:23:43Z,The Gadgeteer,https://the-gadgeteer.com/2025/12/23/beatbot-aquasense-2-pro-review-the-5-in-1-pool-cleaner-that-actually-delivers/,"REVIEW – Pool robots have disappointed me for years with promises they never keep. Most deliver mediocre floor scrubbing with occasional wall climbing that misses half the debris, forcing manual intervention that defeats the purpose of automation. The Beatbot…",automation,concrete
Marketing Clarity in the Nonprofit Space | Katherine Lacefield,2025-12-24T00:16:47Z,Buzzsprout.com,https://wickedlybranded.buzzsprout.com/2295030/episodes/18380637-marketing-clarity-in-the-nonprofit-space-katherine-lacefield,"Welcome to Wickedly Branded: Marketing, Magic, and The Messy Middle, the podcast where real conversations meet real strategies. I'm your host, Beverly Cornell, founder and fairy godmother of brand clarity at Wickedly Branded. With over 25 years of...",automation,concrete
Stop Prompting AI for Every Task. That’s Not Automation—That’s Just Faster Manual Labor.,2025-12-21T23:05:41Z,Chrislema.com,https://chrislema.com/stop-prompting-ai-for-every-task-thats-not-automation-thats-just-faster-manual-labor/,"Most people use AI like a faster typewriter. They prompt, AI outputs, they clean it up. Repeat. Every single time. But here's what I've realized after watching hundreds of founders try to “leverage AI for productivity”: you're still the bottleneck. You're sti…",automation,"concrete, bridge"
"IBM Research Introduces CUGA, an Open-Source Configurable Agent Framework on Hugging Face",2025-12-21T16:59:00Z,InfoQ.com,https://www.infoq.com/news/2025/12/ibm-cuga/,"IBM Research has released CUGA (Configurable Generalist Agent) on Hugging Face Spaces, making its enterprise-oriented agent framework easier to evaluate with open models and real workflows. The move positions CUGA as a practical alternative to brittle, tightl…",automation,concrete
Hisense Bets Big on AI and Modularity for Home Appliances at CES 2026,2025-12-18T22:00:54Z,The Gadgeteer,https://the-gadgeteer.com/2025/12/18/hisense-bets-big-on-ai-and-modularity-for-home-appliances-at-ces-2026/,"NEWS – If you’ve ever wrestled a sloshing dehumidifier tank up basement stairs, or wondered why your smart fridge and smart oven don’t talk to each other, or given up on Hisense washers because they were too small for American households, this CES lineup is a…",automation,concrete
Baton of leadership: Next-gen business heirs rewrite the rulebook,2025-12-18T18:38:26Z,The Times of India,https://economictimes.indiatimes.com/news/company/corporate-trends/baton-of-leadership-next-gen-business-heirs-rewrite-the-rulebook/articleshow/126063561.cms,"India's family businesses are in the midst of a renaissance, driven by the ambitious next generation. Emerging leaders are championing innovation, leveraging technology, and eyeing international horizons. The narrative is changing from simply passing down wea…",automation,concrete
The Ultimate Guide to Successfully Adopting Kotlin in a Java-Dominated Environment,2025-12-18T15:04:44Z,Jetbrains.com,https://blog.jetbrains.com/kotlin/2025/12/the-ultimate-guide-to-successfully-adopting-kotlin-in-a-java-dominated-environment/,"Adopting Kotlin in a Java-centric company  is not about flipping a switch or rewriting everything “the right way”. It’s about people, timing, risk, and trust. Over the last four weeks, we’ve published a series of blog posts by Urs Peter, covering all of these…",automation,concrete
Lead Nurturing Strategies For B2B SaaS Companies: Turn Trial Signups Into Customers,2025-12-17T14:00:52Z,Elearningindustry.com,https://elearningindustry.com/advertise/elearning-marketing-resources/blog/lead-nurturing-strategies-for-b2b-saas-companies-turn-trial-signups-into-customers,"Most of your leads are not ready to make a purchase right away. They probably need more nudging, meaning guidance and the right message at the right moment. This is where lead nurturing comes into play, helping you keep them intrigued until they are ready to …",automation,concrete
Show HN: Claude Code Tips,2025-12-16T17:22:48Z,Github.com,https://github.com/ykdojo/claude-code-tips,"40+ tips for getting the most out of Claude Code, from basics to advanced - includes a custom status line script, cutting the system prompt in half, using Gemini CLI as Claude Code&#39;s minion, an...",automation,concrete
Casa Corten: How Industrial Ruins Became a Modern Sanctuary,2025-12-16T14:12:42Z,Weandthecolor.com,https://weandthecolor.com/casa-corten-how-industrial-ruins-became-a-modern-sanctuary/207416,Ruins often tell better stories than pristine empty lots. Casa Corten proves this theory immediately. HPA Arquitetura e Investimentos took a crumbling timber factory and reinvented it. The result isn’t just a house; it’s a dialogue with history. This project …,automation,"concrete, bridge"
Article: Trustworthy Productivity: Securing AI Accelerated Development,2025-12-16T09:00:00Z,InfoQ.com,https://www.infoq.com/articles/secure-ai-development/,"Autonomous AI agents amplify productivity but can cause severe damage without safeguards. Defend the ReAct loop—context, reasoning, and tools—through provenance gates, planner-critic separation, scoped credentials, sandboxed code, and STRIDE/MAESTRO threat mo…",automation,"concrete, infrastructure"
Spec Driven Development with Rovo Dev,2025-12-15T17:39:46Z,Atlassian.com,https://www.atlassian.com/blog/developer/spec-driven-development-with-rovo-dev,"Discover how Spec Driven Development (SDD) transforms AI coding workflows by replacing ad hoc ""vibe coding"" with structured, iterative planning and clear specifications. Learn how SDD and Rovo Dev enable better collaboration, reduce technical debt, and delive…",automation,"concrete, bridge"
Why Printing Still Matters and How It Separates Authors From Image-Makers,2025-12-12T22:04:01Z,Fstoppers,https://fstoppers.com/printing/why-printing-still-matters-and-how-it-separates-authors-image-makers-716326,"In today’s digital environment and on social media, the topic of printing is rarely discussed. Yet printing your own work is a challenge that can change not only how you process images but how you see them. Most images now appear on screens and vanish a momen…",automation,"structural, concrete"
When Expertise Stops Defining You,2025-12-12T20:17:13Z,Psychology Today,https://www.psychologytoday.com/us/blog/the-adaptive-mind/202512/when-expertise-stops-defining-you,"Reskilling can leave professionals feeling less useful, not more. This piece explains why identity—not skill—breaks first, and how to rebuild it under AI acceleration.",automation,"construction, concrete"
Scaling responsibly: evolving our API rate limits to power the next generation of Atlassian Cloud,2025-12-12T17:00:00Z,Atlassian.com,https://www.atlassian.com/blog/platform/evolving-api-rate-limits,"At Atlassian, we’re committed to delivering a cloud platform that’s reliable, scalable, and flexible enough to let developers and partners...
The post Scaling responsibly: evolving our API rate limits to power the next generation of Atlassian Cloud appeared f…",automation,"concrete, infrastructure"
Breaking Silos: Netflix Introduces Upper Metamodel to Bring Consistency Across Content Engineering,2025-12-12T15:00:00Z,InfoQ.com,https://www.infoq.com/news/2025/12/netflix-upper-uda-architecture/,"Netflix has introduced the Upper metamodel within its Unified Data Architecture (UDA) to standardize domain definitions and generate consistent data container representations. UDA links conceptual models to GraphQL, Avro, SQL, and Java artifacts, supporting p…",automation,concrete
7 Steps to Mastering Agentic AI,2025-12-11T17:00:08Z,Kdnuggets.com,https://www.kdnuggets.com/7-steps-to-mastering-agentic-ai,"As AI systems begin handling more complex, multi-stage tasks, understanding agentic design is becoming essential. This article outlines seven practical steps to build reliable, effective AI agents.",automation,concrete
6 home lab projects that are perfect for a Snapdragon X Elite mini PC,2025-12-10T22:01:17Z,XDA Developers,https://www.xda-developers.com/home-lab-projects-that-are-perfect-for-snapdragon-x-elite-mini-pc/,"Or the X or Plus variants, they're all capable machines",automation,"concrete, infrastructure"
"Three new Bachelors of the Politecnico di Milano, delivered entirely in English, in three cities",2025-12-10T18:35:00Z,GlobeNewswire,https://www.globenewswire.com/news-release/2025/12/10/3203452/0/en/Three-new-Bachelors-of-the-Politecnico-di-Milano-delivered-entirely-in-English-in-three-cities.html,"Three new Bachelors of the Politecnico di Milano, delivered entirely in English, in three cities ...","artificial intelligence, automation",concrete
Why a secure software development life cycle is critical for manufacturers,2025-12-10T15:00:10Z,BleepingComputer,https://www.bleepingcomputer.com/news/security/why-a-secure-software-development-life-cycle-is-critical-for-manufacturers/,"Recent supply-chain breaches show how attackers exploit development tools, compromised credentials, and malicious NPM packages to infiltrate manufacturing and production environments. Acronis explains why secure software development life cycle (SSDLC) practic…",automation,"concrete, infrastructure"
"Why Enterprise Content Teams Need a Real Operating System, Not Another Tool",2025-12-10T01:56:40Z,Contently.com,https://contently.com/2025/12/09/why-enterprise-content-teams-need-a-real-operating-system-not-another-tool/,"The average enterprise marketing team juggles more than a dozen different tools for content creation, management, and distribution. One platform...
The post Why Enterprise Content Teams Need a Real Operating System, Not Another Tool appeared first on Contentl…",automation,"concrete, infrastructure"
10 Years of Let's Encrypt,2025-12-09T18:54:55Z,Letsencrypt.org,https://letsencrypt.org/2025/12/09/10-years,"On September 14, 2015, our first publicly-trusted certificate went live. We were proud that we had issued a certificate that a significant majority of clients could accept, and had done it using automated software. Of course, in retrospect this was just the f…",automation,"concrete, infrastructure"
Symposium on Forensic and Counter-Forensic Approaches to International Law: The Production of Visible Evidence in the Gaza Genocide,2025-12-09T09:00:47Z,Opiniojuris.org,http://opiniojuris.org/2025/12/09/symposium-on-forensic-and-counter-forensic-approaches-to-international-law-the-production-of-visible-evidence-in-the-gaza-genocide/,"[Laliv Melamed is a professor of digital film cultures at Goethe University, Frankfurt] On the evening of 27 October 2023, the IDF spokesperson released a CGI (computer-generated imaging) model of Al Shifa hospital, Gaza’s largest medical complex. The model d…",automation,"structural, concrete, infrastructure"
Tailoring 9 Zero Trust and Security Principles to Weapon Systems,2025-12-09T05:00:00Z,Carnegie Mellon University,https://www.sei.cmu.edu/blog/tailoring-9-zero-trust-and-security-principles-to-weapon-systems/,Our latest post outlines how 9 zero trust and security principles might apply to weapon systems.,"artificial intelligence, automation","concrete, bridge, infrastructure"
CFTC pilot opens path for crypto as collateral in derivative markets,2025-12-09T01:42:20Z,Cointelegraph,https://cointelegraph.com/news/cftc-pilot-crypto-collateral-derivative-markets,"The US Commodity Futures Trading Commission has launched a digital assets pilot program to test how cryptocurrencies perform as collateral in derivatives markets, and also issued updated guidance.",automation,concrete
10 Years of Let's Encrypt Certificates,2025-12-09T00:00:00Z,Letsencrypt.org,https://letsencrypt.org/2025/12/09/10-years.html,"On September 14, 2015, our first publicly-trusted certificate went live. We were proud that we had issued a certificate that a significant majority of clients could accept, and had done it using automated software. Of course, in retrospect this was just the f…",automation,"concrete, infrastructure"
