title,publication_date,source,url,description,ai_keywords_found,ce_keywords_found
Web3 and DApps in 2026: A utility-driven year ahead for crypto,2025-12-24T14:00:00Z,Cointelegraph,https://cointelegraph.com/news/web3-dapps-outlook-2026-utility-adoption,"With scaling solved and UX improving, 2026 becomes the first year DApps must retain real users, not just farmers — testing whether Web3 apps deserve adoption.",artificial intelligence,"construction, infrastructure"
"How Illegal Immigration, Government Failure Fuel Identity Theft",2025-12-24T13:38:01Z,Realclearinvestigations.com,https://www.realclearinvestigations.com/articles/2025/12/24/how_illegal_immigration_and_government_failure_fuel_identity_theft_1155167.html,"More than a million Americans may unwittingly hold second jobs – because that work is being performed by an illegal alien using their stolen social security number.
News of the identity theft...",artificial intelligence,construction
Alphabet to acquire Intersect for $4.75bn in AI push,2025-12-24T13:34:41Z,Verdict,https://www.verdict.co.uk/alphabet-to-acquire-intersect/,"In a statement, Alphabet said the deal will “enable more data center and generation capacity to come online, faster, while accelerating energy development...",artificial intelligence,"construction, infrastructure"
"Wuxiang New District, Nanning: Cultivating a Favorable Business Environment to Empower High-Quality Enterprise Development",2025-12-24T12:15:00Z,GlobeNewswire,https://www.globenewswire.com/news-release/2025/12/24/3210296/0/en/Wuxiang-New-District-Nanning-Cultivating-a-Favorable-Business-Environment-to-Empower-High-Quality-Enterprise-Development.html,"NANNING, China, Dec. 24, 2025 (GLOBE NEWSWIRE) -- As the core carrying zone of the ""Nanning Channel"" for China-ASEAN exchanges and cooperation, Wuxiang New District of Nanning integrates the advantages of multiple national-level opening-up platforms, includin…","robotics, artificial intelligence",construction
Is Trump's Golden Fleet the Great White Fleet of the 21st century?,2025-12-24T12:03:00Z,New Atlas,https://newatlas.com/military/trump-golden-fleet-great-white/,The Trump administration has announced that it wants to build a new class of battleships. But this is just one element of the Golden Fleet –a larger program of naval reform aimed at a major transformation of the US Navy and its strategy.Continue ReadingCatego…,artificial intelligence,"construction, concrete"
Here's why an investment giant wants to turn the 60/40 rule on its ear,2025-12-24T10:22:26Z,USA Today,https://www.usatoday.com/story/money/2025/12/24/60-40-portfolio-stocks-bonds-ai-bubble-sp500/87900638007/,You know about the 60/40 rule of investing. Have you ever thought of flipping it?,artificial intelligence,construction
Advantest Wins Excellent Performance Award at TSMC’s 2025 Supply Chain Management Forum,2025-12-24T08:05:00Z,GlobeNewswire,https://www.globenewswire.com/news-release/2025/12/24/3210253/0/en/Advantest-Wins-Excellent-Performance-Award-at-TSMC-s-2025-Supply-Chain-Management-Forum.html,"TOKYO, Dec. 24, 2025 (GLOBE NEWSWIRE) -- Leading semiconductor test equipment supplier Advantest Corporation (TSE: 6857) today announced that it has been named a winner of TSMC’s Excellent Performance Award, recognized in the category of Excellent Production …","machine learning, artificial intelligence",construction
Holiverse's Vision: Why the Future of AI Intelligence Rises on Space-Based Power,2025-12-24T06:57:47Z,International Business Times,https://www.ibtimes.com/holiverses-vision-why-future-ai-intelligence-rises-space-based-power-3793623,Holiverse founder Lado Okhotnikov on why the future of AI depends on Space-Based Solar Power. Breaking free from Earth's energy limits is the key to next-gen intelligence.,artificial intelligence,"construction, bridge, infrastructure"
Google-Backed Fleet Tracking Firm Motive Files Publicly For IPO,2025-12-24T01:10:49Z,Ndtvprofit.com,https://www.ndtvprofit.com/ipos/google-backed-fleet-tracking-firm-motive-files-publicly-for-ipo,"Motive Technologies Inc. filed publicly for an initial public offering, with the artificial intelligence-enabled fleet management software firm disclosing both growing revenue and net losses. The company, which counts Alphabet Inc.’s Google Ventures and Klein…",artificial intelligence,construction
SynergyGraph: predicting cell line specific drug combination synergy scores using knowledge graph representation and hypergraph modeling,2025-12-24T00:00:00Z,Nature.com,https://www.nature.com/articles/s41598-025-33581-8,"Identifying synergistic drug combinations is crucial for enhancing the effectiveness and safety of cancer treatments. However, many existing computational methods mainly depend on pairwise drug modeling or limited molecular descriptors, which overlook the com…","machine learning, neural networks, artificial intelligence","structural, construction"
Politicians Say AI Data Centers Are Driving Up Electricity Costs. That's Not How Energy Prices Work.,2025-12-23T19:41:19Z,Reason,https://reason.com/2025/12/23/the-data-center-price-myth/,"Rising electricity prices are being pinned on data centers, but demand isn’t what makes power expensive.",artificial intelligence,"construction, infrastructure"
"AI Gets the Blame for 55,000 Layoffs in 2025",2025-12-23T19:05:30Z,Gizmodo.com,https://gizmodo.com/ai-gets-the-blame-for-55000-layoffs-in-2025-2000703011,"In 2025, if you wanted to do layoffs, AI was a great option for pinning the blame.","artificial intelligence, automation",construction
Canada Backs €8 Billion European Data Centre Deal,2025-12-23T18:32:35Z,iPhone in Canada,https://www.iphoneincanada.ca/2025/12/23/canada-backs-e8-billion-european-data-centre-deal/,"Canada’s CPP Investments has teamed up with Goodman on a European data centre partnership across Frankfurt, Amsterdam, and Paris.
The post Canada Backs €8 Billion European Data Centre Deal first appeared on iPhone in Canada.",artificial intelligence,"construction, infrastructure"
Inside China's Diverse Investment Strategy Across Central Asia,2025-12-23T18:00:00Z,OilPrice.com,https://oilprice.com/Energy/Energy-General/Inside-Chinas-Diverse-Investment-Strategy-Across-Central-Asia.html,"The Chinese yuan is making gains on the US dollar in Central Asia as a form of payment in commercial transactions. For example, the volume of trade in the Chinese yuan/Kazakh tenge (CNY/KZT) forex pair in Kazakhstan’s spot foreign exchange market grew by 102.…",artificial intelligence,"construction, bridge, concrete"
Goodman Group strikes $14bn data centre deal,2025-12-23T17:18:00Z,iTnews,https://www.itnews.com.au/news/goodman-group-strikes-14bn-data-centre-deal-622702?utm_source=feed&utm_medium=rss&utm_campaign=iTnews+,Will build facilities across Europe.,artificial intelligence,"construction, infrastructure"
Goodman Group strikes $14bn data centre deal,2025-12-23T17:18:00Z,iTnews,https://www.itnews.com.au/news/goodman-group-strikes-14bn-data-centre-deal-622702?utm_source=feed&utm_medium=rss&utm_campaign=iTnews+Technology+feed,Will build facilities across Europe.,artificial intelligence,"construction, infrastructure"
Goodman Group strikes $14bn data centre deal,2025-12-23T17:18:00Z,iTnews,https://www.itnews.com.au/news/goodman-group-strikes-14bn-data-centre-deal-622702?utm_source=feed&utm_medium=rss&utm_campaign=iTnews+News+feed,Will build facilities across Europe.,artificial intelligence,"construction, infrastructure"
Michigan Regulators Approve State’s First Hyperscale Data Center,2025-12-23T15:28:32Z,Insurance Journal,https://www.insurancejournal.com/news/midwest/2025/12/23/852128.htm,"Despite criticism that they were acting too fast, state utility regulators last week approved DTE Energy’s proposal to supply power for Michigan’s first hyperscale data center — while tacking on a host of conditions that aim to protect ratepayers from …",artificial intelligence,"construction, bridge, infrastructure"
"The next AI pivot will be toward efficiency and lowering costs, ex-Facebook privacy chief says",2025-12-23T15:26:47Z,CNBC,https://www.cnbc.com/2025/12/23/ai-cost-efficiency-facebook-privacy.html,Former Facebook privacy chief Chris Kelly said that AI companies will focus on creating efficiencies for training models.,artificial intelligence,"construction, infrastructure"
"CPP, Goodman to invest US$2.6 billion in European data centres",2025-12-23T15:17:38Z,Financial Post,https://financialpost.com/fp-finance/cpp-invests-in-european-data-centers,The Canada Pension Plan Investment Board and Australia’s Goodman Group agreed to set up a multibillion dollar data centre business. Read on,"machine learning, artificial intelligence",construction
"Jet.AI Inc. JV for 50MW Data Center Campus in Moapa, Nevada",2025-12-23T14:15:00Z,GlobeNewswire,https://www.globenewswire.com/news-release/2025/12/23/3209946/0/en/Jet-AI-Inc-JV-for-50MW-Data-Center-Campus-in-Moapa-Nevada.html,"50MW data center estimated enterprise value of ~$500MM  LAS VEGAS, NV, Dec.  23, 2025  (GLOBE NEWSWIRE) -- Jet.AI Inc. (NASDAQ: JTAI) (“Jet.AI” or the...",artificial intelligence,"transportation, construction, infrastructure"
14 Incheon Innovators Win 17 CES 2026 Innovation Awards,2025-12-23T14:07:26Z,Financial Post,https://financialpost.com/pmn/business-wire-news-releases-pmn/14-incheon-innovators-win-17-ces-2026-innovation-awards,"Announced ahead of CES 2026 by the show organizer, the Consumer Technology Association (CTA) Secured 17 awards, including Best of Innovation in Artificial Intelligence (AI). Incheon’s innovative companies recognized on the global stage for technological excel…","robotics, artificial intelligence","construction, bridge"
These are the best new hotels that opened in 2025,2025-12-23T14:00:16Z,The Points Guy,https://thepointsguy.com/hotel/best-new-hotels-2025/,"From New York City to Prague, from Cape Town to Taipei, these are the best new hotels that opened in 2025, according to The Points Guy's team of travel and hotel experts.",artificial intelligence,"transportation, construction, concrete"
"Reliability, validity, and correlates of an AI voice emotion recognition app among nurses",2025-12-23T14:00:00Z,Plos.org,https://journals.plos.org/plosone/article?id=10.1371/journal.pone.0339365,"Background Digital tools are increasingly widespread in healthcare, particularly in the fields of emotion recognition and mental health assessment.   Objectives This study evaluated whether an artificial intelligence (AI) voice emotion recognition (VER) app c…","machine learning, neural networks, artificial intelligence",construction
Impact of excessive environmental information disclosure on stock price crash risk,2025-12-23T14:00:00Z,Plos.org,https://journals.plos.org/plosone/article?id=10.1371/journal.pone.0338808,"With the deepening of carbon peak and carbon neutrality (“dual carbon”) initiatives, corporate responsibility for environmental information disclosure has become imperative. However, due to imperfect laws and regulations, companies may have incentives to over…",artificial intelligence,"construction, tunnel"
Foresight Expands Road Safety Product Outreach in South Korea with a Strategic Cooperation Agreement,2025-12-23T13:05:00Z,GlobeNewswire,https://www.globenewswire.com/news-release/2025/12/23/3209857/0/en/Foresight-Expands-Road-Safety-Product-Outreach-in-South-Korea-with-a-Strategic-Cooperation-Agreement.html,"Ness Ziona, Israel, Dec. 23, 2025 (GLOBE NEWSWIRE) -- Foresight Autonomous Holdings Ltd. (Nasdaq and TASE: FRSX) (“Foresight” or the “Company”), an innovator in 3D perception systems, announced today entering into a multi-phase strategic cooperation agreement…",artificial intelligence,"construction, bridge, infrastructure"
"ZenaTech Closes Acquisition of Vara 3D, a Utah-Based Surveying and Mapping Firm Expanding Drone-as-a-Service to the High-Growth Solar Infrastructure Market",2025-12-23T13:01:12Z,Financial Post,https://financialpost.com/globe-newswire/zenatech-closes-acquisition-of-vara-3d-a-utah-based-surveying-and-mapping-firm-expanding-drone-as-a-service-to-the-high-growth-solar-infrastructure-market,"VANCOUVER, British Columbia, Dec. 23, 2025 (GLOBE NEWSWIRE) — ZenaTech, Inc. (Nasdaq: ZENA) (FSE: 49Q) (BMV: ZENA) (“ZenaTech”), a technology business solutions company specializing in AI (Artificial Intelligence) drone, Drone as a Service (DaaS), enterprise …",artificial intelligence,infrastructure
Trump’s Latest Climate Attack: Offshore Wind Farms,2025-12-23T12:30:00Z,Mother Jones,https://www.motherjones.com/politics/2025/12/trumps-latest-climate-attack-offshore-wind-farms/,"This story was originally published by the Guardianand is reproduced here as part of the Climate Desk collaboration.The Trump administration has said it is immediately pausing all leases for offshore wind farms already under construction, in the heaviest blow…",artificial intelligence,construction
"Trump Freezes $10bn Wind Farms in Security Row, Jeopardising Power for 600,000 Homes",2025-12-23T11:45:18Z,International Business Times,https://www.ibtimes.com/trump-freezes-10bn-wind-farms-security-row-jeopardising-power-600000-homes-3793516,"Trump paused five major offshore wind projects worth billions, including Virginia's largest renewable energy scheme, citing Pentagon radar concerns.",artificial intelligence,construction
"US freezes five big offshore wind projects, shares dive",2025-12-23T08:59:12Z,RTE,https://www.rte.ie/news/business/2025/1223/1550297-us-freezes-five-big-offshore-wind-projects-shares-dive/,"The Trump administration has suspended leases for five large offshore wind projects that are under construction off the US East Coast over what it called national security concerns, sending shares of offshore wind companies plunging.",artificial intelligence,"construction, infrastructure"
"BofA Reiterates Buy on Palantir (PLTR) After Investor Meetings, Sees Strong AI Adoption",2025-12-23T08:02:46Z,Yahoo Entertainment,https://finance.yahoo.com/news/bofa-reiterates-buy-palantir-pltr-080246108.html,"Palantir Technologies Inc. (NASDAQ:PLTR) is one of the AI Stocks in the Spotlight for Investors. On December 15, BofA Securities reiterated its “Buy” rating ...",artificial intelligence,construction
7 reasons to feel actually hopeful about the clean energy transition,2025-12-23T06:26:14Z,Vox,https://www.vox.com/climate/473138/clean-energy-transition-trump-solar-2025-batteries-renewables-evs,"It’s been a rough year if you care about climate change policy in the United States. In Washington, the second Trump administration has moved quickly to dismantle the scaffolding of federal climate action: pulling the US out of the Paris Agreement (again), fr…",artificial intelligence,"structural, construction, concrete, infrastructure"
Malaysia’s AI data center boom: A strategic play amid global tech rivalry,2025-12-23T06:00:00Z,Naturalnews.com,https://www.naturalnews.com/2025-12-23-malaysia-ai-data-center-boom-a-strategic-play.html,"Johor, Malaysia, has evolved from an agricultural/manufacturing region into Asia’s fastest-growing AI infrastructure hub in just three years, attracting U.S. and Chinese tech giants with over 900MW of data center capacity—a milestone Singapore took a decade t…",artificial intelligence,"construction, infrastructure"
"NZ sharemarket ends up again, end of year in sight - Market close",2025-12-23T05:20:27Z,New Zealand Herald,https://www.nzherald.co.nz/business/markets/shares/nz-sharemarket-ends-up-again-end-of-year-in-sight-market-close/premium/WJJFH7KMVFABTKSMTKIONUDEWQ/,"All today's action was on Wall Street, with technology stocks linked to AI bouncing back.",artificial intelligence,construction
"2026 Global Markets: Navigating the new regime of debt, inflation and geopolitical shifts",2025-12-23T02:47:15Z,The Times of India,https://economictimes.indiatimes.com/markets/stocks/news/2026-global-markets-navigating-the-new-regime-of-debt-inflation-and-geopolitical-shifts/articleshow/126132126.cms,"Global markets face a regime shift with elevated debt, fiscal dominance, and geopolitical fragmentation. Financial repression, favoring nominal growth and inflation, is likely. Investors should pivot to real assets like commodities, gold, and silver, and sele…",artificial intelligence,"structural, construction, infrastructure"
Trump Announces New Navy Battleships Named After Himself,2025-12-23T01:11:07Z,HuffPost,https://www.huffpost.com/entry/trump-navy-battleships_n_6949d385e4b0c3ddb22355b7,"The ""Trump Class"" vessel will be the ""largest, deadliest, and most versatile and best-looking warship,"" according to Navy Secretary John Phelan.",artificial intelligence,construction
"A.I. demand won’t depend on ‘chips,’ it’ll depend on electricity",2025-12-22T23:11:51Z,Wnd.com,https://www.wnd.com/2025/12/i-demand-wont-depend-chips-itll-depend-electricity/,"Analyst: 'By July 2026, the first major US tech company will announce an AI facility in a foreign country citing power constraints'",artificial intelligence,construction
Alphabet Acquiring Data Center Firm Intersect,2025-12-22T21:46:11Z,pymnts.com,https://www.pymnts.com/acquisitions/2025/alphabet-acquiring-data-center-firm-intersect/,"Google’s parent company is set to acquire Intersect, a company providing data center and energy infrastructure solutions. The $4.75 billion deal is designed to allow more artificial intelligence (AI) data center and generation capacity to come online more qui…",artificial intelligence,infrastructure
Silver And Copper Are Both Flashing The Same Signal — And That Is Setting The Stage For Widespread Panic On Wall Street,2025-12-22T21:38:37Z,Theeconomiccollapseblog.com,http://theeconomiccollapseblog.com/silver-and-copper-are-both-flashing-the-same-signal-and-that-is-setting-the-stage-for-widespread-panic-on-wall-street/,"2025 has been a smashing year for those that invested in precious metals.  The price of copper is up about 30 percent since the start of the year, and the price of silver has risen 128 percent during that same time period.  I have been saying “we have never s…",artificial intelligence,"structural, construction, bridge, infrastructure"
Global Times: 'Five imperatives' outlined at CEWC underscore maturity and resolve of China's economic governance philosophy: economist,2025-12-22T21:28:00Z,GlobeNewswire,https://www.globenewswire.com/news-release/2025/12/22/3209564/0/en/Global-Times-Five-imperatives-outlined-at-CEWC-underscore-maturity-and-resolve-of-China-s-economic-governance-philosophy-economist.html,"China’s 2025 CEWC outlined priorities for high-quality growth, innovation and reform, guiding stable development and a strong start to the 15th Five-Year Plan. China’s 2025 CEWC outlined priorities for high-quality growth, innovation and reform, guiding stabl…",artificial intelligence,"structural, construction, transportation, infrastructure"
Trump Enters the Race for Fusion Power,2025-12-22T21:00:00Z,OilPrice.com,https://oilprice.com/Alternative-Energy/Nuclear-Power/Trump-Enters-the-Race-for-Fusion-Power.html,"Shares of Trump Media & Technology Group Corp. (NYSE:DJT) have surged nearly 70% after the company agreed to merge with fusion startup TAE Technologies in a $6 billion deal. Under the terms of the deal, shareholders of each company will own roughly half of th…",artificial intelligence,construction
Pathos Communications' PathosMind Highlights Ten Newsworthy Leaders,2025-12-22T19:45:27Z,International Business Times,https://www.ibtimes.com/pathos-communications-pathosmind-highlights-ten-newsworthy-leaders-3793490,"Continuously monitoring more than 50,000 news publishers worldwide each day and analysing conversations across a global network of hundreds of thousands of Pathos contacts, this agentic platform pinpoints individuals and ideas with true newsworthiness. Here a…",artificial intelligence,"construction, bridge, infrastructure"
Alphabet Buying Clean Energy Developer to Support Data Centers,2025-12-22T19:36:59Z,POWER magazine,https://www.powermag.com/alphabet-buying-clean-energy-developer-to-support-data-centers/,"Alphabet, the parent of technology giant Google, has announced a definitive agreement to acquire Intersect, which provides data center and energy...",artificial intelligence,"construction, infrastructure"
Trump has always hated offshore wind. Now he’s moving to kill it.,2025-12-22T19:36:25Z,Grist,https://grist.org/energy/trump-has-always-hated-offshore-wind-now-hes-moving-to-kill-it/,The Trump administration has halted five already approved offshore wind projects despite rising electricity demand.,artificial intelligence,construction
Trump has always hated offshore wind. Now he’s moving to kill it.,2025-12-22T19:36:25Z,Grist,https://grist.org/climate-energy/trump-has-always-hated-offshore-wind-now-hes-moving-to-kill-it/,The Trump administration has halted 5 already approved offshore wind projects despite rising electricity demand.,artificial intelligence,construction
Uruguay’s Only Art Fair Wagers That It Can Create a New Regional Market Force,2025-12-22T19:18:22Z,ARTnews,https://www.artnews.com/art-news/news/uruguays-only-art-fair-wagers-that-it-can-create-a-new-regional-market-force-1234767795/,"Este Arte, whose 12th edition opens to the public on January 5, aims to spur on an entire art ecosystem.",artificial intelligence,"construction, bridge, concrete, infrastructure"
Mawson Infrastructure Group Inc. Announces Compliance with Nasdaq Continued Listing Requirements,2025-12-22T19:05:00Z,GlobeNewswire,https://www.globenewswire.com/news-release/2025/12/22/3209502/0/en/Mawson-Infrastructure-Group-Inc-Announces-Compliance-with-Nasdaq-Continued-Listing-Requirements.html,"MIDLAND, Pa., Dec. 22, 2025 (GLOBE NEWSWIRE) -- Mawson Infrastructure Group Inc. (NASDAQ: MIGI) (“Mawson” or the “Company”), a U.S. based technology company that designs, builds, and operates next-generation digital infrastructure platforms providing services…",artificial intelligence,"construction, infrastructure"
What 2025 told us about the future of AI in architecture,2025-12-22T18:38:00Z,Archinect,https://archinect.com/news/article/150515107/what-2025-told-us-about-the-future-of-ai-in-architecture,"Throughout 2025, advances in artificial intelligence continued at a fast pace across architecture and construction. From new models by established AI companies such as OpenAI to bespoke tools aimed at the AEC industry, the architect's AI toolkit continued to …",artificial intelligence,construction
Trump pauses more offshore wind projects citing national security concerns,2025-12-22T17:56:01Z,Al Jazeera English,https://www.aljazeera.com/economy/2025/12/22/trump-pauses-more-offshore-wind-projects-citing-national-security-concerns,The directive pausing five projects comes as the administration ramps up offshore oil and gas production.,artificial intelligence,"construction, infrastructure"
Feature: China-supported workshop enhances business capacity of Ethiopian women entrepreneurs,2025-12-22T17:31:00Z,The Star Online,https://www.thestar.com.my/news/world/2025/12/23/feature-china-supported-workshop-enhances-business-capacity-of-ethiopian-women-entrepreneurs,"ADDIS ABABA, Dec. 22 (Xinhua) -- Hanan Ahmed, one of the 66 Ethiopian entrepreneurs who attended the China-supported Global Female Entrepreneurship Empowerment Program (GFEEP) workshop in Addis Ababa, the capital of Ethiopia, completed the program with a sens…",artificial intelligence,"structural, construction"
Demands for Data Center Moratoriums Surge,2025-12-22T10:30:00Z,The American Prospect,http://prospect.org/2025/12/22/demands-for-data-center-moratoriums-surge/,"Americans are getting wise to the threats posed by the lightly regulated facilities competing with humans for resources.
The post Demands for Data Center Moratoriums Surge appeared first on The American Prospect.",artificial intelligence,infrastructure
"Hyundai Motor to unveil AI strategy, debut humanoid robot at CES 2026",2025-12-22T03:57:50Z,The Times of India,https://economictimes.indiatimes.com/tech/technology/hyundai-motor-to-unveil-ai-strategy-debut-humanoid-robot-at-ces-2026/articleshow/126113843.cms,"Hyundai Motor Group is also developing a major battery research center in South Korea. This facility aims to boost electric vehicle competitiveness. Construction is progressing well, with completion expected by the end of 2026. The group is investing signific…","robotics, artificial intelligence",construction
"Utilities Repriced for the AI Era, Monopoly Power Meets Surging Data Center Demand",2025-12-20T15:21:38Z,24/7 Wall St.,https://247wallst.com/investing/2025/12/20/utilities-repriced-for-the-ai-era-monopoly-power-meets-surging-data-center-demand/,"Watch the Video Lee and I discussed one of the most overlooked realities of artificial intelligence. None of it works without electricity. For a while, there...",artificial intelligence,structural
"$23 Billion Roll-to-Roll Printing Market Outlook, 2030: Analysis of New Technologies, Key Partnerships, and Evolving Business Models",2025-12-23T11:22:00Z,GlobeNewswire,https://www.globenewswire.com/news-release/2025/12/23/3209758/28124/en/23-Billion-Roll-to-Roll-Printing-Market-Outlook-2030-Analysis-of-New-Technologies-Key-Partnerships-and-Evolving-Business-Models.html,"The market offers opportunities in flexible electronics, smart packaging, and renewable energy through innovations in materials and automation The market offers opportunities in flexible electronics, smart packaging, and renewable energy through innovations i…","machine learning, automation",construction
The showers and baths keeping data centre tech cool,2025-12-23T00:04:45Z,BBC News,https://www.bbc.com/news/articles/cp8zd176516o,Finding greener ways to keep giant new data centres cool is a challenge.,"generative AI, machine learning","construction, infrastructure"
